{
  "metadata": {
    "timestamp": "2025-06-12T23:58:08.604311",
    "project_name": "LLMdiver",
    "analysis_type": "general"
  },
  "project_context": {
    "primary_language": "unknown",
    "framework": "unknown"
  },
  "code_metrics": {},
  "ai_analysis": {
    "raw_text": "## Executive Summary\nThe LLMdiver repository appears to be empty, with no valid code files detected during the analysis. This suggests that the repository may contain only configuration or documentation files, or that the file patterns in the repomix configuration are too restrictive. Given this context, the analysis will focus on providing recommendations for improving the repository's structure and security posture.\n\n## Critical Issues (Priority: CRITICAL)\nNone\n\n## High Priority Concerns (Priority: HIGH)\nNone\n\n## Technical Debt & TODOs (Priority: MEDIUM)\n1. **Repository Setup**: The repository appears to be empty, which may indicate a missing or incomplete setup process.\n\t* Recommendation: Review the project's documentation and ensure that all necessary files are present.\n2. **Dependency Management**: Since no manifest files were found, it is unclear what dependencies are being used in the project.\n\t* Recommendation: Implement dependency management using a package manager like pip or npm to track dependencies and their versions.\n\n## Dead Code & Optimization (Priority: LOW)\nNone\n\n## Actionable Recommendations\n1. **Review Project Documentation**: Ensure that all necessary files are present, including code files, manifest files, and documentation.\n2. **Implement Dependency Management**: Use a package manager to track dependencies and their versions, and ensure that the project's security posture is maintained.\n3. **Configure Repomix Patterns**: Review and adjust the repomix configuration to include file patterns for unknown languages or frameworks, if applicable.\n\nEstimated Impact: High\nEstimated Effort: Medium\n\nNote: Given the empty repository, these recommendations focus on setting up a solid foundation for future development. Once code files are added, further analysis can be conducted to identify specific technical debt and areas for improvement.",
    "structured_findings": {
      "executive_summary": "The LLMdiver repository appears to be empty, with no valid code files detected during the analysis. This suggests that the repository may contain only configuration or documentation files, or that the file patterns in the repomix configuration are too restrictive. Given this context, the analysis will focus on providing recommendations for improving the repository's structure and security posture.",
      "critical_issues": [],
      "high_priority": [],
      "medium_priority": [
        "1. **Repository Setup**: The repository appears to be empty, which may indicate a missing or incomplete setup process.",
        "* Recommendation: Review the project's documentation and ensure that all necessary files are present.",
        "2. **Dependency Management**: Since no manifest files were found, it is unclear what dependencies are being used in the project.",
        "* Recommendation: Implement dependency management using a package manager like pip or npm to track dependencies and their versions."
      ],
      "low_priority": [],
      "recommendations": [
        "1. **Review Project Documentation**: Ensure that all necessary files are present, including code files, manifest files, and documentation.",
        "2. **Implement Dependency Management**: Use a package manager to track dependencies and their versions, and ensure that the project's security posture is maintained.",
        "3. **Configure Repomix Patterns**: Review and adjust the repomix configuration to include file patterns for unknown languages or frameworks, if applicable."
      ]
    }
  },
  "semantic_analysis": {
    "has_similar_code": false,
    "similar_blocks_found": 0,
    "context_text": ""
  }
}