{
  "metadata": {
    "timestamp": "2025-06-13T00:00:50.847387",
    "project_name": "LLMdiver",
    "analysis_type": "general"
  },
  "project_context": {
    "primary_language": "unknown",
    "framework": "unknown"
  },
  "code_metrics": {},
  "ai_analysis": {
    "raw_text": "## Executive Summary\nThe LLMdiver repository appears to be empty or contains no valid code files for analysis. This may indicate that the repository is incomplete, misconfigured, or intentionally designed without source code. Given this context, our analysis will focus on potential issues related to dependency security and language-specific patterns.\n\n## Critical Issues (Priority: CRITICAL)\nNone found due to lack of code.\n\n## High Priority Concerns (Priority: HIGH)\nNone found due to lack of code.\n\n## Technical Debt & TODOs (Priority: MEDIUM)\n- **Repository Configuration**: Review repomix configuration for file pattern restrictions and ignore patterns. Ensure they are not inadvertently excluding valid code files.\n- **Language Detection**: Investigate the primary language used in the project, as it is currently unknown. This will help in applying language-specific best practices and common issues.\n\n## Dead Code & Optimization (Priority: LOW)\nNone found due to lack of code.\n\n## Actionable Recommendations\n1. **Re-evaluate Repository Configuration**:\n\t* Review repomix configuration for file pattern restrictions and ignore patterns.\n\t* Adjust configurations as necessary to include valid code files.\n2. **Detect Primary Language**:\n\t* Use tools or manual inspection to determine the primary language used in the project.\n\t* Apply language-specific best practices and common issues once identified.\n\nNote: Given the repository's current state, these recommendations focus on addressing potential configuration issues and identifying the primary language for future analysis.",
    "structured_findings": {
      "executive_summary": "The LLMdiver repository appears to be empty or contains no valid code files for analysis. This may indicate that the repository is incomplete, misconfigured, or intentionally designed without source code. Given this context, our analysis will focus on potential issues related to dependency security and language-specific patterns.",
      "critical_issues": [],
      "high_priority": [],
      "medium_priority": [
        "- **Repository Configuration**: Review repomix configuration for file pattern restrictions and ignore patterns. Ensure they are not inadvertently excluding valid code files.",
        "- **Language Detection**: Investigate the primary language used in the project, as it is currently unknown. This will help in applying language-specific best practices and common issues."
      ],
      "low_priority": [],
      "recommendations": [
        "1. **Re-evaluate Repository Configuration**:",
        "* Review repomix configuration for file pattern restrictions and ignore patterns.",
        "* Adjust configurations as necessary to include valid code files.",
        "2. **Detect Primary Language**:",
        "* Use tools or manual inspection to determine the primary language used in the project.",
        "* Apply language-specific best practices and common issues once identified."
      ]
    }
  },
  "semantic_analysis": {
    "has_similar_code": false,
    "similar_blocks_found": 0,
    "context_text": ""
  }
}