{
  "metadata": {
    "timestamp": "2025-06-13T00:00:17.602418",
    "project_name": "LLMdiver",
    "analysis_type": "general"
  },
  "project_context": {
    "primary_language": "unknown",
    "framework": "unknown"
  },
  "code_metrics": {},
  "ai_analysis": {
    "raw_text": "## Executive Summary\nThe LLMdiver repository appears to be empty or contains only configuration/documentation files, making it impossible to conduct a comprehensive code review. However, based on the analysis instructions provided, I will outline potential concerns and recommendations.\n\n## Critical Issues (Priority: CRITICAL)\nNone found due to lack of code.\n\n## High Priority Concerns (Priority: HIGH)\nNone found due to lack of code.\n\n## Technical Debt & TODOs (Priority: MEDIUM)\n1. **Missing Code**: The repository is empty, which may indicate a missing or incomplete project.\n2. **Unknown Language/Framework**: The primary language and framework are unknown, making it challenging to provide specific recommendations.\n3. **Manifest Files Missing**: The absence of manifest files may lead to dependency security issues if not properly managed.\n\n## Dead Code & Optimization (Priority: LOW)\nNone found due to lack of code.\n\n## Actionable Recommendations\n1. **Re-evaluate Project Structure**: Review the repository's organization and ensure it accurately reflects the project's scope.\n2. **Identify Primary Language/Framework**: Determine the primary language and framework used in the project to provide targeted recommendations.\n3. **Implement Dependency Management**: Introduce manifest files or equivalent dependency management mechanisms to ensure secure and efficient package handling.\n\nNote: These recommendations are based on the provided analysis instructions and the repository's current state. A more comprehensive review would require access to the actual codebase.",
    "structured_findings": {
      "executive_summary": "The LLMdiver repository appears to be empty or contains only configuration/documentation files, making it impossible to conduct a comprehensive code review. However, based on the analysis instructions provided, I will outline potential concerns and recommendations.",
      "critical_issues": [],
      "high_priority": [],
      "medium_priority": [
        "1. **Missing Code**: The repository is empty, which may indicate a missing or incomplete project.",
        "2. **Unknown Language/Framework**: The primary language and framework are unknown, making it challenging to provide specific recommendations.",
        "3. **Manifest Files Missing**: The absence of manifest files may lead to dependency security issues if not properly managed."
      ],
      "low_priority": [],
      "recommendations": [
        "1. **Re-evaluate Project Structure**: Review the repository's organization and ensure it accurately reflects the project's scope.",
        "2. **Identify Primary Language/Framework**: Determine the primary language and framework used in the project to provide targeted recommendations.",
        "3. **Implement Dependency Management**: Introduce manifest files or equivalent dependency management mechanisms to ensure secure and efficient package handling."
      ]
    }
  },
  "semantic_analysis": {
    "has_similar_code": false,
    "similar_blocks_found": 0,
    "context_text": ""
  }
}