{
  "metadata": {
    "timestamp": "2025-06-12T23:54:54.217337",
    "project_name": "LLMdiver",
    "analysis_type": "general"
  },
  "project_context": {
    "primary_language": "unknown",
    "framework": "unknown"
  },
  "code_metrics": {},
  "ai_analysis": {
    "raw_text": "## Executive Summary\nThe LLMdiver repository appears to be empty or contains no valid code files for analysis. This may indicate that the repository is incomplete, misconfigured, or intentionally designed without source code. Given this situation, there are no critical issues to report.\n\n## Critical Issues (Priority: CRITICAL)\nNone\n\n## High Priority Concerns (Priority: HIGH)\nNone\n\n## Technical Debt & TODOs (Priority: MEDIUM)\n- The repository's primary language and framework are unknown, which may indicate a lack of documentation or configuration.\n- No valid code files were found for analysis, suggesting potential issues with the repository's setup or configuration.\n\n## Dead Code & Optimization (Priority: LOW)\nNone\n\n## Actionable Recommendations\n1. **Verify Repository Configuration**: Review the repository's configuration and ensure that it is correctly set up to store source code.\n2. **Add Code Files**: If the repository is intended to contain code, add valid files to facilitate analysis.\n3. **Update Documentation**: Update project documentation to reflect the correct primary language and framework used in the repository.\n\nEstimated Impact: High\nEstimated Effort: Low-Medium\n\nNote: Given the current state of the repository, these recommendations focus on resolving the underlying issues rather than addressing specific code-related concerns.",
    "structured_findings": {
      "executive_summary": "The LLMdiver repository appears to be empty or contains no valid code files for analysis. This may indicate that the repository is incomplete, misconfigured, or intentionally designed without source code. Given this situation, there are no critical issues to report.",
      "critical_issues": [],
      "high_priority": [],
      "medium_priority": [
        "- The repository's primary language and framework are unknown, which may indicate a lack of documentation or configuration.",
        "- No valid code files were found for analysis, suggesting potential issues with the repository's setup or configuration."
      ],
      "low_priority": [],
      "recommendations": [
        "1. **Verify Repository Configuration**: Review the repository's configuration and ensure that it is correctly set up to store source code.",
        "2. **Add Code Files**: If the repository is intended to contain code, add valid files to facilitate analysis.",
        "3. **Update Documentation**: Update project documentation to reflect the correct primary language and framework used in the repository."
      ]
    }
  },
  "semantic_analysis": {
    "has_similar_code": false,
    "similar_blocks_found": 0,
    "context_text": ""
  }
}