{
  "metadata": {
    "timestamp": "2025-06-12T23:57:18.588358",
    "project_name": "LLMdiver",
    "analysis_type": "general"
  },
  "project_context": {
    "primary_language": "unknown",
    "framework": "unknown"
  },
  "code_metrics": {},
  "ai_analysis": {
    "raw_text": "## Executive Summary\nThe LLMdiver repository appears to be empty or contains no valid code files for analysis. This may indicate that the repository is incomplete, misconfigured, or intentionally designed without source code. Given this situation, there are no critical issues to report.\n\n## Critical Issues (Priority: CRITICAL)\nNone\n\n## High Priority Concerns (Priority: HIGH)\nNone\n\n## Technical Debt & TODOs (Priority: MEDIUM)\n- The repository's primary language and framework are unknown, which may indicate a lack of documentation or planning.\n- There are no valid code files for analysis, making it impossible to assess maintainability issues.\n\n## Dead Code & Optimization (Priority: LOW)\n- Since there is no code, there are no dead functions or redundant code to report.\n\n## Actionable Recommendations\n1. **Verify Repository Integrity**: Ensure the repository contains actual source code and not just configuration or documentation files.\n2. **Configure Repomix Correctly**: Review and adjust file patterns in repomix configuration to correctly identify and analyze code files.\n3. **Document Language and Framework**: Update project metadata to reflect the primary language and framework used, if applicable.\n\n**Estimated Impact:** High (Repository integrity and analysis accuracy)\n**Estimated Effort:** Low-Medium (Depends on repository correction and configuration adjustments)\n\nNote: Given the current state of the repository, it's essential to address these issues before proceeding with a comprehensive code review.",
    "structured_findings": {
      "executive_summary": "The LLMdiver repository appears to be empty or contains no valid code files for analysis. This may indicate that the repository is incomplete, misconfigured, or intentionally designed without source code. Given this situation, there are no critical issues to report.",
      "critical_issues": [],
      "high_priority": [],
      "medium_priority": [
        "- The repository's primary language and framework are unknown, which may indicate a lack of documentation or planning.",
        "- There are no valid code files for analysis, making it impossible to assess maintainability issues."
      ],
      "low_priority": [
        "- Since there is no code, there are no dead functions or redundant code to report."
      ],
      "recommendations": [
        "1. **Verify Repository Integrity**: Ensure the repository contains actual source code and not just configuration or documentation files.",
        "2. **Configure Repomix Correctly**: Review and adjust file patterns in repomix configuration to correctly identify and analyze code files.",
        "3. **Document Language and Framework**: Update project metadata to reflect the primary language and framework used, if applicable.",
        "**Estimated Impact:** High (Repository integrity and analysis accuracy)",
        "**Estimated Effort:** Low-Medium (Depends on repository correction and configuration adjustments)"
      ]
    }
  },
  "semantic_analysis": {
    "has_similar_code": false,
    "similar_blocks_found": 0,
    "context_text": ""
  }
}