{
  "metadata": {
    "timestamp": "2025-06-12T23:55:24.914852",
    "project_name": "LLMdiver",
    "analysis_type": "general"
  },
  "project_context": {
    "primary_language": "unknown",
    "framework": "unknown"
  },
  "code_metrics": {},
  "ai_analysis": {
    "raw_text": "## Executive Summary\nThe LLMdiver repository appears to be empty or contains no valid code files for analysis. This may indicate that the repository is incomplete, misconfigured, or intentionally designed without source code. Given this situation, there are no critical issues to report.\n\n## Critical Issues (Priority: CRITICAL)\nNone\n\n## High Priority Concerns (Priority: HIGH)\nNone\n\n## Technical Debt & TODOs (Priority: MEDIUM)\n- The repository's primary language and framework are unknown, which makes it challenging to provide targeted analysis or recommendations.\n- There are no valid code files for analysis, indicating potential issues with the repository's configuration or ignore patterns.\n\n## Dead Code & Optimization (Priority: LOW)\nNone\n\n## Actionable Recommendations\n1. **Verify Repository Integrity**: Investigate why there are no valid code files in the repository. Check for misconfigured file patterns, incorrect ignore settings, or intentional design decisions.\n2. **Determine Primary Language and Framework**: Identify the primary language and framework used in the project to provide targeted analysis and recommendations.\n3. **Re-evaluate Analysis Instructions**: Given the unknown language and framework, re-assess the importance of dependency security, language-specific patterns, code structure, and code reuse.\n\nEstimated Impact: High (due to potential misconfiguration or intentional design decisions)\nEstimated Effort: Medium (depending on the complexity of investigating repository integrity and determining primary language/framework)",
    "structured_findings": {
      "executive_summary": "The LLMdiver repository appears to be empty or contains no valid code files for analysis. This may indicate that the repository is incomplete, misconfigured, or intentionally designed without source code. Given this situation, there are no critical issues to report.",
      "critical_issues": [],
      "high_priority": [],
      "medium_priority": [
        "- The repository's primary language and framework are unknown, which makes it challenging to provide targeted analysis or recommendations.",
        "- There are no valid code files for analysis, indicating potential issues with the repository's configuration or ignore patterns."
      ],
      "low_priority": [],
      "recommendations": [
        "1. **Verify Repository Integrity**: Investigate why there are no valid code files in the repository. Check for misconfigured file patterns, incorrect ignore settings, or intentional design decisions.",
        "2. **Determine Primary Language and Framework**: Identify the primary language and framework used in the project to provide targeted analysis and recommendations.",
        "3. **Re-evaluate Analysis Instructions**: Given the unknown language and framework, re-assess the importance of dependency security, language-specific patterns, code structure, and code reuse."
      ]
    }
  },
  "semantic_analysis": {
    "has_similar_code": false,
    "similar_blocks_found": 0,
    "context_text": ""
  }
}