{
  "metadata": {
    "timestamp": "2025-06-12T23:56:43.201099",
    "project_name": "LLMdiver",
    "analysis_type": "general"
  },
  "project_context": {
    "primary_language": "unknown",
    "framework": "unknown"
  },
  "code_metrics": {},
  "ai_analysis": {
    "raw_text": "## Executive Summary\nThe LLMdiver repository appears to be empty or contains no valid code files for analysis. This may indicate that the repository is incomplete, misconfigured, or intentionally designed without source code. Given this situation, there are no critical issues to report.\n\n## Critical Issues (Priority: CRITICAL)\nNone\n\n## High Priority Concerns (Priority: HIGH)\nNone\n\n## Technical Debt & TODOs (Priority: MEDIUM)\n- The repository's primary language and framework are unknown, which may indicate a lack of documentation or planning.\n- There are no valid code files for analysis, suggesting potential issues with configuration or ignore patterns.\n\n## Dead Code & Optimization (Priority: LOW)\n- No dead code can be identified since there is no code to analyze.\n\n## Actionable Recommendations\n1. **Verify Repository Integrity**: Check the repository's configuration and ignore patterns to ensure they are not inadvertently filtering out valid code files.\n2. **Add or Update Documentation**: Provide information about the project's primary language, framework, and any relevant dependencies.\n3. **Populate the Repository with Code**: Add source code files to enable analysis and improve maintainability.\n\nEstimated Impact: High\nEstimated Effort: Medium\n\nNote: Given the repository's current state, these recommendations focus on resolving the underlying issues rather than addressing specific technical concerns.",
    "structured_findings": {
      "executive_summary": "The LLMdiver repository appears to be empty or contains no valid code files for analysis. This may indicate that the repository is incomplete, misconfigured, or intentionally designed without source code. Given this situation, there are no critical issues to report.",
      "critical_issues": [],
      "high_priority": [],
      "medium_priority": [
        "- The repository's primary language and framework are unknown, which may indicate a lack of documentation or planning.",
        "- There are no valid code files for analysis, suggesting potential issues with configuration or ignore patterns."
      ],
      "low_priority": [
        "- No dead code can be identified since there is no code to analyze."
      ],
      "recommendations": [
        "1. **Verify Repository Integrity**: Check the repository's configuration and ignore patterns to ensure they are not inadvertently filtering out valid code files.",
        "2. **Add or Update Documentation**: Provide information about the project's primary language, framework, and any relevant dependencies.",
        "3. **Populate the Repository with Code**: Add source code files to enable analysis and improve maintainability."
      ]
    }
  },
  "semantic_analysis": {
    "has_similar_code": false,
    "similar_blocks_found": 0,
    "context_text": ""
  }
}