{
  "metadata": {
    "timestamp": "2025-06-12T23:53:33.482414",
    "project_name": "LLMdiver",
    "analysis_type": "general"
  },
  "project_context": {
    "primary_language": "unknown",
    "framework": "unknown"
  },
  "code_metrics": {},
  "ai_analysis": {
    "raw_text": "## Executive Summary\nThe LLMdiver repository appears to be empty or incomplete, with no valid code files found for analysis. This suggests that the repository may contain only configuration or documentation files, or that the file patterns in the repomix configuration are too restrictive.\n\n## Critical Issues (Priority: CRITICAL)\nNone\n\n## High Priority Concerns (Priority: HIGH)\nNone\n\n## Technical Debt & TODOs (Priority: MEDIUM)\n- **Repository Incompleteness**: The repository appears to be empty, which may indicate a lack of development or maintenance.\n- **Unknown Language and Framework**: The primary language and framework used in the project are unknown, making it difficult to provide specific recommendations.\n\n## Dead Code & Optimization (Priority: LOW)\nNone\n\n## Actionable Recommendations\n1. **Verify Repository Contents**: Check if the repository is intentionally empty or if there's an issue with the file patterns in the repomix configuration.\n2. **Determine Primary Language and Framework**: Identify the primary language and framework used in the project to provide more specific recommendations.\n3. **Create a New Project Structure**: If the repository is indeed empty, consider creating a new project structure and starting from scratch.\n\nEstimated Impact: High\nEstimated Effort: Medium\n\nNote: Since the repository appears to be incomplete or empty, it's challenging to provide actionable recommendations without further information about the project's requirements and goals.",
    "structured_findings": {
      "executive_summary": "The LLMdiver repository appears to be empty or incomplete, with no valid code files found for analysis. This suggests that the repository may contain only configuration or documentation files, or that the file patterns in the repomix configuration are too restrictive.",
      "critical_issues": [],
      "high_priority": [],
      "medium_priority": [
        "- **Repository Incompleteness**: The repository appears to be empty, which may indicate a lack of development or maintenance.",
        "- **Unknown Language and Framework**: The primary language and framework used in the project are unknown, making it difficult to provide specific recommendations."
      ],
      "low_priority": [],
      "recommendations": [
        "1. **Verify Repository Contents**: Check if the repository is intentionally empty or if there's an issue with the file patterns in the repomix configuration.",
        "2. **Determine Primary Language and Framework**: Identify the primary language and framework used in the project to provide more specific recommendations.",
        "3. **Create a New Project Structure**: If the repository is indeed empty, consider creating a new project structure and starting from scratch."
      ]
    }
  },
  "semantic_analysis": {
    "has_similar_code": false,
    "similar_blocks_found": 0,
    "context_text": ""
  }
}