{
  "metadata": {
    "timestamp": "2025-06-12T23:54:44.506683",
    "project_name": "LLMdiver",
    "analysis_type": "general"
  },
  "project_context": {
    "primary_language": "unknown",
    "framework": "unknown"
  },
  "code_metrics": {},
  "ai_analysis": {
    "raw_text": "## Executive Summary\nThe LLMdiver repository appears to be empty or incomplete, with no valid code files found for analysis. This suggests that the repository may contain only configuration or documentation files, or that the file patterns in the repomix configuration are too restrictive.\n\n## Critical Issues (Priority: CRITICAL)\nNone\n\n## High Priority Concerns (Priority: HIGH)\nNone\n\n## Technical Debt & TODOs (Priority: MEDIUM)\n- **Repository Incomplete**: The repository appears to be empty or incomplete, which may indicate a lack of development activity or an abandoned project.\n- **Missing Language Information**: The primary language and framework used in the project are unknown, making it difficult to apply specific best practices and common issues.\n\n## Dead Code & Optimization (Priority: LOW)\nNone\n\n## Actionable Recommendations\n1. **Verify Repository Integrity**: Check if the repository is indeed empty or incomplete, and investigate why no valid code files were found.\n2. **Update Language Information**: Determine the primary language and framework used in the project to apply relevant best practices and common issues.\n3. **Reconfigure File Patterns**: Review and adjust the file patterns in the repomix configuration to ensure that all code files are included in the analysis.\n\nEstimated Impact: High\nEstimated Effort: Low-Medium\n\nNote: The lack of valid code files makes it challenging to provide specific recommendations for security, performance, or maintainability. However, addressing the repository's incompleteness and updating language information will be essential steps in moving forward with the analysis.",
    "structured_findings": {
      "executive_summary": "The LLMdiver repository appears to be empty or incomplete, with no valid code files found for analysis. This suggests that the repository may contain only configuration or documentation files, or that the file patterns in the repomix configuration are too restrictive.",
      "critical_issues": [],
      "high_priority": [],
      "medium_priority": [
        "- **Repository Incomplete**: The repository appears to be empty or incomplete, which may indicate a lack of development activity or an abandoned project.",
        "- **Missing Language Information**: The primary language and framework used in the project are unknown, making it difficult to apply specific best practices and common issues."
      ],
      "low_priority": [],
      "recommendations": [
        "1. **Verify Repository Integrity**: Check if the repository is indeed empty or incomplete, and investigate why no valid code files were found.",
        "2. **Update Language Information**: Determine the primary language and framework used in the project to apply relevant best practices and common issues.",
        "3. **Reconfigure File Patterns**: Review and adjust the file patterns in the repomix configuration to ensure that all code files are included in the analysis."
      ]
    }
  },
  "semantic_analysis": {
    "has_similar_code": false,
    "similar_blocks_found": 0,
    "context_text": ""
  }
}