{
  "metadata": {
    "timestamp": "2025-06-12T23:55:36.397941",
    "project_name": "LLMdiver",
    "analysis_type": "general"
  },
  "project_context": {
    "primary_language": "unknown",
    "framework": "unknown"
  },
  "code_metrics": {},
  "ai_analysis": {
    "raw_text": "## Executive Summary\nThe LLMdiver repository appears to be empty or contains no valid code files for analysis. This may indicate that the repository is incomplete, misconfigured, or intentionally designed without source code. Given this situation, there are no critical issues to report.\n\n## Critical Issues (Priority: CRITICAL)\nNone\n\n## High Priority Concerns (Priority: HIGH)\nNone\n\n## Technical Debt & TODOs (Priority: MEDIUM)\n- The repository's primary language and framework are unknown, which may indicate a lack of documentation or planning.\n- There are no valid code files for analysis, suggesting potential issues with configuration, ignore patterns, or file organization.\n\n## Dead Code & Optimization (Priority: LOW)\nNone\n\n## Actionable Recommendations\n1. **Verify Repository Integrity**: Investigate the repository's structure and configuration to ensure it is complete and correctly set up.\n2. **Determine Primary Language and Framework**: Identify the primary language and framework used in the project, if any, to inform further analysis and recommendations.\n3. **Re-evaluate Ignore Patterns**: Review ignore patterns to ensure they are not inadvertently filtering out relevant code files.\n4. **Consider Refactoring or Reorganization**: If similar code is found elsewhere in the repository (though unlikely given the current state), evaluate opportunities for refactoring and deduplication.\n\nEstimated Impact: High\nEstimated Effort: Medium-High\n\nNote: Given the empty nature of this repository, further analysis would require additional information about the project's context and goals.",
    "structured_findings": {
      "executive_summary": "The LLMdiver repository appears to be empty or contains no valid code files for analysis. This may indicate that the repository is incomplete, misconfigured, or intentionally designed without source code. Given this situation, there are no critical issues to report.",
      "critical_issues": [],
      "high_priority": [],
      "medium_priority": [
        "- The repository's primary language and framework are unknown, which may indicate a lack of documentation or planning.",
        "- There are no valid code files for analysis, suggesting potential issues with configuration, ignore patterns, or file organization."
      ],
      "low_priority": [],
      "recommendations": [
        "1. **Verify Repository Integrity**: Investigate the repository's structure and configuration to ensure it is complete and correctly set up.",
        "2. **Determine Primary Language and Framework**: Identify the primary language and framework used in the project, if any, to inform further analysis and recommendations.",
        "3. **Re-evaluate Ignore Patterns**: Review ignore patterns to ensure they are not inadvertently filtering out relevant code files."
      ]
    }
  },
  "semantic_analysis": {
    "has_similar_code": false,
    "similar_blocks_found": 0,
    "context_text": ""
  }
}