{
  "metadata": {
    "timestamp": "2025-06-12T23:52:58.666382",
    "project_name": "LLMdiver",
    "analysis_type": "general"
  },
  "project_context": {
    "primary_language": "unknown",
    "framework": "unknown"
  },
  "code_metrics": {},
  "ai_analysis": {
    "raw_text": "## Executive Summary\nThe LLMdiver repository appears to be empty or contains no valid code files for analysis. This may indicate that the repository is incomplete, misconfigured, or intentionally designed without source code. Given this situation, there are no critical issues to report.\n\n## Critical Issues (Priority: CRITICAL)\nNone\n\n## High Priority Concerns (Priority: HIGH)\nNone\n\n## Technical Debt & TODOs (Priority: MEDIUM)\n- The repository's primary language and framework are unknown, which may indicate a lack of documentation or planning.\n- There are no valid code files for analysis, making it impossible to assess maintainability issues.\n\n## Dead Code & Optimization (Priority: LOW)\n- Since there is no code, there are no opportunities for dead code removal or minor optimizations.\n\n## Actionable Recommendations\n1. **Verify Repository Integrity**: Ensure the repository contains actual source code and not just configuration files or documentation.\n2. **Configure Repomix Correctly**: Review and adjust file patterns in the repomix configuration to include all relevant code files, if any exist.\n3. **Plan for Future Development**: If the repository is intentionally empty, plan for future development by defining a project architecture, selecting a primary language and framework, and creating a manifest file.\n\nEstimated Impact: High (repository integrity and planning)\nEstimated Effort: Medium (configuring repomix and planning for future development)",
    "structured_findings": {
      "executive_summary": "The LLMdiver repository appears to be empty or contains no valid code files for analysis. This may indicate that the repository is incomplete, misconfigured, or intentionally designed without source code. Given this situation, there are no critical issues to report.",
      "critical_issues": [],
      "high_priority": [],
      "medium_priority": [
        "- The repository's primary language and framework are unknown, which may indicate a lack of documentation or planning.",
        "- There are no valid code files for analysis, making it impossible to assess maintainability issues."
      ],
      "low_priority": [
        "- Since there is no code, there are no opportunities for dead code removal or minor optimizations."
      ],
      "recommendations": [
        "1. **Verify Repository Integrity**: Ensure the repository contains actual source code and not just configuration files or documentation.",
        "2. **Configure Repomix Correctly**: Review and adjust file patterns in the repomix configuration to include all relevant code files, if any exist.",
        "3. **Plan for Future Development**: If the repository is intentionally empty, plan for future development by defining a project architecture, selecting a primary language and framework, and creating a manifest file."
      ]
    }
  },
  "semantic_analysis": {
    "has_similar_code": false,
    "similar_blocks_found": 0,
    "context_text": ""
  }
}